{
  "schemaVersion": 1,
  "protocol": "afterburner.ui",
  "revision": 1,
  "action": "rotate",
  "at": "2026-09-04T20:21:10Z",
  "previousEpoch": 1,
  "grant": {
    "id": "invoke-submit",
    "extensionId": "extension-1",
    "capability": "ui.action.invoke",
    "resources": ["surface.submit/action.submit"],
    "effect": "allow",
    "epoch": 2,
    "createdAt": "2026-09-04T20:20:00Z",
    "reason": "key rotation"
  }
}
